{
  "manifestVersion": 2,
  "packageId": "community.lifecycle-proof",
  "packageVersion": "1.0.0",
  "display": {
    "name": "Local Lifecycle Proof",
    "description": "Synthetic inactive package used only to prove deterministic local package admission evidence."
  },
  "publisher": {
    "id": "community.replay-lab-example",
    "name": "Replay Lab Example Publisher"
  },
  "license": {
    "expression": "MIT",
    "noticePath": "LICENSE"
  },
  "hostApiRange": "^1.0.0",
  "contractProfile": "local-declarative-package-v1",
  "capabilities": {
    "provides": [],
    "requires": [],
    "extends": []
  },
  "contributions": [],
  "settings": {
    "schemaVersion": 1,
    "tabs": [
      {
        "id": "inputs",
        "source": {
          "kind": "settings",
          "fields": [
            {
              "id": "lifecycleLabel",
              "label": "Lifecycle label",
              "scopes": [
                "package",
                "profile"
              ],
              "defaultValue": "inactive",
              "control": {
                "kind": "text",
                "maxLength": 32
              }
            }
          ]
        }
      }
    ]
  },
  "permissions": [],
  "execution": {
    "tier": "none",
    "entrypoint": null
  },
  "persistence": {
    "schemaVersion": 1,
    "retention": "preserve-on-uninstall",
    "migrations": []
  },
  "conformance": {
    "sdkVersion": "1.0.0",
    "toolchainDigest": "sha256:1fcc0f8f7537ea80f4121e456a42dd2e373766560696e08236b5780d85345d00",
    "requiredReceiptDigests": []
  }
}
